Id	Nome	Morada	NIF	LocalTrabalho
1	Orlando Manuel Oliveira Belo	NULL	128129130	Universidade do Minho
2	João Miguel Lobo Fernandes	NULL	155200200	Universidade do Minho
3	Vitor Francisco Mendes Freitas Gomes Fonte	NULL	177188199	Universidade do Minho
4	João Alexandre Baptista Vieira Saraiva	NULL	221196677	Universidade do Minho
5	Pedro Miguel Silva Paiva António	Ed.7, Sala 1.04, Rua da Universidade, Braga 4710-057	111222333	Universidade do Minho
6	Paulo Manuel Martins Carvalho	NULL	314782421	Universidade do Minho
